{"schema_version":"pricebridge.opportunities.v1","fixture_kind":"curated_frontend_design_sample","currency":"EUR","generated_from":["exports/phone_opportunities_v2_strong.json","exports/laptop_opportunities_v2_cleaned.json","exports/console_opportunities_v1.json"],"sample_policy":{"purpose":"UI design, prototyping, and frontend data-contract development","not_for_trading_decisions":true,"curated":true,"notes":["Fields are normalized across phones, laptops, and portable consoles.","Known duplicate or clearly unsafe rows were omitted.","Warnings preserve meaningful data-quality issues so the UI can design review states.","Evidence URL arrays are intentionally capped for a compact handoff fixture; listing_count preserves source totals."]},"recommendation_values":["strong_opportunity","good_opportunity","watch","weak_evidence","avoid"],"items":[{"id":"phone-samsung-galaxy-z-fold-7-512","category":"phone","brand":"Samsung","model":"Galaxy Z Fold 7","model_id":33,"variant_label":"512 GB","image_url":null,"specifications":{"storage_gb":512},"prices":{"algeria":{"min_eur":956.68,"avg_eur":965.71,"listing_count":2},"turkiye":{"min_eur":1437.03,"avg_eur":1460.37,"listing_count":2}},"opportunity":{"margin_eur":503.69,"margin_percent":52.65,"confidence_score":56,"recommendation":"good_opportunity","source_recommendation":"buy","warnings":["medium_confidence","small_evidence_sample"]},"gain_split":{"pricing_basis":"turkiye_market","gross_margin_eur":503.69,"trader_gain_eur":251.85,"buyer_gain_eur":251.85,"proposed_buyer_price_eur":1208.53,"buyer_gain_percent":20.84,"trader_share_percent":50.0,"deal_quality":"medium"},"buyer_proposal":{"eur":1208.53,"usd":1381.96,"dzd":333953.09,"try":64705.9},"evidence":{"algeria_urls":["https://www.ouedkniss.com/store/6442/abdou-cabba-store/annonce/55347235","https://www.ouedkniss.com/store/6442/abdou-cabba-store/annonce/55424305"],"turkiye_urls":["https://www.sahibinden.com/ilan/ikinci-el-ve-sifir-alisveris-cep-telefonu-aksesuar-cep-telefonu-galaxy-z-fold-7-512gb-sifir-kapali-kutu,magazadan-takas-plustaksit-1315574883/detay","https://www.sahibinden.com/ilan/ikinci-el-ve-sifir-alisveris-cep-telefonu-aksesuar-cep-telefonu-samsung-galaxy-z-fol7-sifir-kapali-kutu-512-gb-yd-1322800488/detay"]},"updated_at":null},{"id":"phone-apple-iphone-17-pro-256","category":"phone","brand":"Apple","model":"iPhone 17 Pro","model_id":187,"variant_label":"256 GB","image_url":null,"specifications":{"storage_gb":256},"prices":{"algeria":{"min_eur":682.31,"avg_eur":682.31,"listing_count":1},"turkiye":{"min_eur":895.8,"avg_eur":1135.01,"listing_count":25}},"opportunity":{"margin_eur":452.7,"margin_percent":66.35,"confidence_score":75,"recommendation":"strong_opportunity","source_recommendation":"buy","warnings":["single_algeria_listing"]},"gain_split":{"pricing_basis":"turkiye_market","gross_margin_eur":452.7,"trader_gain_eur":158.45,"buyer_gain_eur":294.26,"proposed_buyer_price_eur":840.76,"buyer_gain_percent":35.0,"trader_share_percent":35.0,"deal_quality":"strong"},"buyer_proposal":{"eur":840.76,"usd":961.41,"dzd":232327.21,"try":45015.13},"evidence":{"algeria_urls":["https://www.instagram.com/deghoul_haroun_telecom/reel/DYC3ptQIxYz/"],"turkiye_urls":["https://www.sahibinden.com/ilan/ikinci-el-ve-sifir-alisveris-cep-telefonu-aksesuar-cep-telefonu-iphone-17-pro-256gb-yurtdisi-1326342645/detay","https://www.sahibinden.com/ilan/ikinci-el-ve-sifir-alisveris-cep-telefonu-aksesuar-cep-telefonu-17-pro-256-gb-yd-cift-simli-pil-100-15-ay-acik-devir-10-1326098194/detay","https://www.sahibinden.com/ilan/ikinci-el-ve-sifir-alisveris-cep-telefonu-aksesuar-cep-telefonu-iphone-17-pro-256-gb-sifir-kapali-kutu-cift-e-sim-bugune-ozel-1326138645/detay"]},"updated_at":null},{"id":"phone-apple-iphone-15-pro-128","category":"phone","brand":"Apple","model":"iPhone 15 Pro","model_id":17,"variant_label":"128 GB","image_url":null,"specifications":{"storage_gb":128},"prices":{"algeria":{"min_eur":357.4,"avg_eur":460.29,"listing_count":3},"turkiye":{"min_eur":522.54,"avg_eur":590.17,"listing_count":4}},"opportunity":{"margin_eur":232.77,"margin_percent":65.13,"confidence_score":72,"recommendation":"strong_opportunity","source_recommendation":"buy","warnings":[]},"gain_split":{"pricing_basis":"turkiye_market","gross_margin_eur":232.77,"trader_gain_eur":58.19,"buyer_gain_eur":174.58,"proposed_buyer_price_eur":415.59,"buyer_gain_percent":42.01,"trader_share_percent":25.0,"deal_quality":"strong"},"buyer_proposal":{"eur":415.59,"usd":475.23,"dzd":114839.98,"try":22251.1},"evidence":{"algeria_urls":["https://www.instagram.com/deghoul_haroun_telecom/reel/DYH92LCI0Ir/","https://www.instagram.com/p/DaVfS09sHP2/","https://www.instagram.com/p/DaIaFm7sUVz/"],"turkiye_urls":["https://www.sahibinden.com/ilan/ikinci-el-ve-sifir-alisveris-cep-telefonu-aksesuar-cep-telefonu-cinar-iletisim-den-iphone-15-pro-128gb-pil88-1325612401/detay","https://www.sahibinden.com/ilan/ikinci-el-ve-sifir-alisveris-cep-telefonu-aksesuar-cep-telefonu-iphone-15pro-128-gb-orjinal-seri-gg-1326158985/detay","https://www.sahibinden.com/ilan/ikinci-el-ve-sifir-alisveris-cep-telefonu-aksesuar-cep-telefonu-varol-iletisim-den-15-pro-yd-hatasiz-yili-kurtariyor-1325996166/detay"]},"updated_at":null},{"id":"phone-samsung-galaxy-s26-ultra-256","category":"phone","brand":"Samsung","model":"Galaxy S26 Ultra","model_id":112,"variant_label":"256 GB","image_url":null,"specifications":{"storage_gb":256},"prices":{"algeria":{"min_eur":750.9,"avg_eur":832.26,"listing_count":14},"turkiye":{"min_eur":802.51,"avg_eur":890.33,"listing_count":143}},"opportunity":{"margin_eur":139.43,"margin_percent":18.57,"confidence_score":90,"recommendation":"watch","source_recommendation":"watch","warnings":["thin_buyer_margin"]},"gain_split":{"pricing_basis":"turkiye_market","gross_margin_eur":139.43,"trader_gain_eur":34.86,"buyer_gain_eur":104.57,"proposed_buyer_price_eur":785.76,"buyer_gain_percent":13.31,"trader_share_percent":25.0,"deal_quality":"weak"},"buyer_proposal":{"eur":785.76,"usd":898.52,"dzd":217129.06,"try":42070.38},"evidence":{"algeria_urls":["https://www.ouedkniss.com/smartphones-samsung-galaxy-s26-ultra-5g-256gb-512gb-kouba-alger-algeria-d56264182","https://www.ouedkniss.com/smartphones-galaxy-s26-ultra-12gb-256gb-2sim-boite-dely-brahim-alger-algeria-d55895821","https://www.ouedkniss.com/smartphones-samsung-galaxy-s26-ultra-256gb12gb-bab-el-oued-alger-algeria-d54364457"],"turkiye_urls":["https://www.sahibinden.com/ilan/ikinci-el-ve-sifir-alisveris-cep-telefonu-aksesuar-cep-telefonu-samsung-gozdesi-s26-ultra-256-gb-takasli-satis-1324638403/detay","https://www.sahibinden.com/ilan/ikinci-el-ve-sifir-alisveris-cep-telefonu-aksesuar-cep-telefonu-premium-seri-s26-ultra-diledigin-aksesuar-hediyesiyle-1324638965/detay","https://www.sahibinden.com/ilan/ikinci-el-ve-sifir-alisveris-cep-telefonu-aksesuar-cep-telefonu-1-yil-garantili-samsung-s26-ultra-256-gb-aksesuar-set-hediyeli-1324639751/detay"]},"updated_at":null},{"id":"laptop-apple-macbook-air-m4-24-512","category":"laptop","brand":"Apple","model":"MacBook Air","model_id":22,"variant_label":"M4 · 24 GB · 512 GB","image_url":null,"specifications":{"cpu":"Apple M4","gpu":"Apple Integrated","ram_gb":24,"storage_gb":512},"prices":{"algeria":{"min_eur":1155.23,"avg_eur":1155.23,"listing_count":1},"turkiye":{"min_eur":1306.41,"avg_eur":1353.07,"listing_count":2}},"opportunity":{"margin_eur":197.84,"margin_percent":17.13,"confidence_score":90,"recommendation":"good_opportunity","source_recommendation":"good_opportunity","warnings":["single_algeria_listing","small_evidence_sample"]},"gain_split":{"pricing_basis":"turkiye_market","gross_margin_eur":197.84,"trader_gain_eur":49.46,"buyer_gain_eur":148.38,"proposed_buyer_price_eur":1204.69,"buyer_gain_percent":12.32,"trader_share_percent":25.0,"deal_quality":"medium"},"buyer_proposal":{"eur":1204.69,"usd":1377.56,"dzd":332891.99,"try":64500.31},"evidence":{"algeria_urls":["https://www.ouedkniss.com/macbooks-macbook-air-m4-10c-cpu-gpu-24go-512nvme-13-pouce-azerty-bab-ezzouar-alger-algeria-d54869690"],"turkiye_urls":["https://www.sahibinden.com/ilan/ikinci-el-ve-sifir-alisveris-bilgisayar-dizustu-notebook-macbook-air-garantili-15-m4-24gb-ram-512gb-sdd-sifirdan-farksiz-1325503979/detay","https://www.sahibinden.com/ilan/ikinci-el-ve-sifir-alisveris-bilgisayar-dizustu-notebook-macbook-air-garantili-15-m4-24gb-ram-512gb-sdd-sifirdan-farksiz-1325518006/detay"]},"updated_at":null},{"id":"laptop-apple-macbook-air-m1-8-256","category":"laptop","brand":"Apple","model":"MacBook Air M1","model_id":415,"variant_label":"M1 · 8 GB · 256 GB","image_url":null,"specifications":{"cpu":"Apple M1","gpu":"Apple Integrated","ram_gb":8,"storage_gb":256},"prices":{"algeria":{"min_eur":375.45,"avg_eur":387.48,"listing_count":3},"turkiye":{"min_eur":541.23,"avg_eur":547.45,"listing_count":3}},"opportunity":{"margin_eur":172.0,"margin_percent":45.81,"confidence_score":100,"recommendation":"strong_opportunity","source_recommendation":"strong_buy","warnings":[]},"gain_split":{"pricing_basis":"turkiye_market","gross_margin_eur":172.0,"trader_gain_eur":43.0,"buyer_gain_eur":129.0,"proposed_buyer_price_eur":418.45,"buyer_gain_percent":30.83,"trader_share_percent":25.0,"deal_quality":"strong"},"buyer_proposal":{"eur":418.45,"usd":478.5,"dzd":115630.29,"try":22404.23},"evidence":{"algeria_urls":["https://www.ouedkniss.com/laptop-macbook-air-m1-8gb-ram-256gb-ssd-mostaganem-algeria-d51145846","https://www.ouedkniss.com/macbooks-macbook-air-m1-8gb-ram-256gb-ssd-comptage-de-cycles-91-mostaganem-algeria-d54145703"],"turkiye_urls":["https://www.sahibinden.com/ilan/ikinci-el-ve-sifir-alisveris-bilgisayar-dizustu-notebook-temiz-macbook-air-m1-8gb-ram-256gb-3-1326967696/detay","https://www.sahibinden.com/ilan/ikinci-el-ve-sifir-alisveris-bilgisayar-dizustu-notebook-temiz-macbook-air-m1-8gb-ram-256gb-hafiza-1-1326959283/detay","https://www.sahibinden.com/ilan/ikinci-el-ve-sifir-alisveris-bilgisayar-dizustu-notebook-kusursuz-ciziksiz-macbook-air-m1-97-pil-